{"$schema":"https://json-schema.org/draft/2020-12/schema","title":"VALP Cost Report","type":"object","required":["schema_version","task_id","currency","accumulated_estimate","projected_estimate","actual_billed","actual_billed_status","usage_attribution","per_agent"],"properties":{"schema_version":{"const":"valp-cost-report.v1"},"task_id":{"type":"string"},"currency":{"const":"USD"},"accumulated_estimate":{"$ref":"#/$defs/estimate"},"projected_estimate":{"$ref":"#/$defs/estimate"},"actual_billed":{"type":["string","null"]},"actual_billed_status":{"enum":["evidenced","not_available"]},"usage_attribution":{"type":"array","items":{"$ref":"#/$defs/attribution"}},"per_agent":{"type":"object"}},"$defs":{"attribution":{"type":"object","required":["event_id","agent"],"properties":{"event_id":{"type":"string","minLength":1},"agent":{"type":"string","minLength":1},"dispatch_id":{"type":"string","minLength":1},"work_item_id":{"type":"string","minLength":1},"retry_of":{"type":"string","minLength":1},"parent_agent":{"type":"string","minLength":1}},"additionalProperties":false},"estimate":{"type":"object","required":["official_list","relay_account","subscription_marginal"],"properties":{"official_list":{"type":"string"},"relay_account":{"type":"string"},"subscription_marginal":{"type":"string"}},"additionalProperties":false}},"additionalProperties":false}
