{"schema_version":"valp-cost-report.v1","task_id":"TASK-COST-001","currency":"USD","accumulated_estimate":{"official_list":"6.000000","relay_account":"4.500000","subscription_marginal":"0.000000"},"projected_estimate":{"official_list":"6.200000","relay_account":"4.650000","subscription_marginal":"0.000000"},"actual_billed":null,"actual_billed_status":"not_available","usage_attribution":[{"event_id":"usage-example-1","agent":"example-agent","dispatch_id":"dispatch-example-1","work_item_id":"implementer:example-agent"}],"per_agent":{"example-agent":{"accumulated_estimate":{"official_list":"6.000000","relay_account":"4.500000","subscription_marginal":"0.000000"},"projected_estimate":{"official_list":"6.200000","relay_account":"4.650000","subscription_marginal":"0.000000"}}}}
